No.	Time		Source		Destination	Protocol Length	Info
1	0.000000	127.0.0.1	127.0.0.1	TCP	51	63063 → 8081 [PSH, ACK] Seq=1 Ack=1 Win=10209 Len=7
2	0.000032	127.0.0.1	127.0.0.1	TCP	44	8081 → 63063 [ACK] Seq=1 Ack=8 Win=10230 Len=0
3	0.000082	127.0.0.1	127.0.0.1	TCP	98	8081 → 63063 [PSH, ACK] Seq=1 Ack=8 Win=10230 Len=54
4	0.000108	127.0.0.1	127.0.0.1	TCP	44	63063 → 8081 [ACK] Seq=8 Ack=55 Win=10209 Len=0
5	0.000170	127.0.0.1	127.0.0.1	TCP	51	63063 → 8081 [PSH, ACK] Seq=8 Ack=55 Win=10209 Len=7
6	0.000196	127.0.0.1	127.0.0.1	TCP	44	8081 → 63063 [ACK] Seq=55 Ack=15 Win=10230 Len=0
7	0.000216	127.0.0.1	127.0.0.1	TCP	98	8081 → 63063 [PSH, ACK] Seq=55 Ack=15 Win=10230 Len=54
8	0.000236	127.0.0.1	127.0.0.1	TCP	44	63063 → 8081 [ACK] Seq=15 Ack=109 Win=10209 Len=0
9	0.184077	127.0.0.1	127.0.0.1	TCP	51	63063 → 8081 [PSH, ACK] Seq=15 Ack=109 Win=10209 Len=7
10	0.184112	127.0.0.1	127.0.0.1	TCP	44	8081 → 63063 [ACK] Seq=109 Ack=22 Win=10230 Len=0
11	0.184159	127.0.0.1	127.0.0.1	TCP	98	8081 → 63063 [PSH, ACK] Seq=109 Ack=22 Win=10230 Len=54
12	0.184185	127.0.0.1	127.0.0.1	TCP	44	63063 → 8081 [ACK] Seq=22 Ack=163 Win=10208 Len=0
13	0.423747	127.0.0.1	127.0.0.1	TCP	51	63063 → 8081 [PSH, ACK] Seq=22 Ack=163 Win=10208 Len=7
14	0.423779	127.0.0.1	127.0.0.1	TCP	44	8081 → 63063 [ACK] Seq=163 Ack=29 Win=10230 Len=0
15	0.423826	127.0.0.1	127.0.0.1	TCP	98	8081 → 63063 [PSH, ACK] Seq=163 Ack=29 Win=10230 Len=54
16	0.423852	127.0.0.1	127.0.0.1	TCP	44	63063 → 8081 [ACK] Seq=29 Ack=217 Win=10208 Len=0
17	0.720190	127.0.0.1	127.0.0.1	TCP	51	63063 → 8081 [PSH, ACK] Seq=29 Ack=217 Win=10208 Len=7
18	0.720222	127.0.0.1	127.0.0.1	TCP	44	8081 → 63063 [ACK] Seq=217 Ack=36 Win=10230 Len=0
19	0.720272	127.0.0.1	127.0.0.1	TCP	98	8081 → 63063 [PSH, ACK] Seq=217 Ack=36 Win=10230 Len=54
20	0.720297	127.0.0.1	127.0.0.1	TCP	44	63063 → 8081 [ACK] Seq=36 Ack=271 Win=10208 Len=0
21	1.898186	127.0.0.1	127.0.0.1	TCP	51	63063 → 8081 [PSH, ACK] Seq=36 Ack=271 Win=10208 Len=7
22	1.898218	127.0.0.1	127.0.0.1	TCP	44	8081 → 63063 [ACK] Seq=271 Ack=43 Win=10230 Len=0
23	1.898268	127.0.0.1	127.0.0.1	TCP	98	8081 → 63063 [PSH, ACK] Seq=271 Ack=43 Win=10230 Len=54
24	1.898294	127.0.0.1	127.0.0.1	TCP	44	63063 → 8081 [ACK] Seq=43 Ack=325 Win=10208 Len=0
25	2.391993	127.0.0.1	127.0.0.1	TCP	51	63063 → 8081 [PSH, ACK] Seq=43 Ack=325 Win=10208 Len=7
26	2.392027	127.0.0.1	127.0.0.1	TCP	44	8081 → 63063 [ACK] Seq=325 Ack=50 Win=10230 Len=0
27	2.392065	127.0.0.1	127.0.0.1	TCP	98	8081 → 63063 [PSH, ACK] Seq=325 Ack=50 Win=10230 Len=54
28	2.392086	127.0.0.1	127.0.0.1	TCP	44	63063 → 8081 [ACK] Seq=50 Ack=379 Win=10208 Len=0
29	5.822378	127.0.0.1	127.0.0.1	TCP	191	59981 → 25734 [PSH, ACK] Seq=1 Ack=1 Win=10041 Len=147
30	5.822424	127.0.0.1	127.0.0.1	TCP	44	25734 → 59981 [ACK] Seq=1 Ack=148 Win=10040 Len=0
31	5.822497	127.0.0.1	127.0.0.1	TCP	191	25734 → 59981 [PSH, ACK] Seq=1 Ack=148 Win=10040 Len=147
32	5.822525	127.0.0.1	127.0.0.1	TCP	44	59981 → 25734 [ACK] Seq=148 Ack=148 Win=10040 Len=0
33	26.094659	192.168.56.1	239.255.255.250	SSDP	206	M-SEARCH * HTTP/1.1 
34	26.094804	192.168.1.3	239.255.255.250	SSDP	206	M-SEARCH * HTTP/1.1 
35	26.094951	172.22.16.1	239.255.255.250	SSDP	206	M-SEARCH * HTTP/1.1 
36	26.095104	172.28.224.1	239.255.255.250	SSDP	206	M-SEARCH * HTTP/1.1 
37	27.103037	192.168.56.1	239.255.255.250	SSDP	206	M-SEARCH * HTTP/1.1 
38	27.103089	192.168.1.3	239.255.255.250	SSDP	206	M-SEARCH * HTTP/1.1 
39	27.103136	172.22.16.1	239.255.255.250	SSDP	206	M-SEARCH * HTTP/1.1 
40	27.103182	172.28.224.1	239.255.255.250	SSDP	206	M-SEARCH * HTTP/1.1 
41	28.118113	192.168.56.1	239.255.255.250	SSDP	206	M-SEARCH * HTTP/1.1 
42	28.118186	192.168.1.3	239.255.255.250	SSDP	206	M-SEARCH * HTTP/1.1 
43	28.118237	172.22.16.1	239.255.255.250	SSDP	206	M-SEARCH * HTTP/1.1 
44	28.118308	172.28.224.1	239.255.255.250	SSDP	206	M-SEARCH * HTTP/1.1 
45	29.133104	192.168.56.1	239.255.255.250	SSDP	206	M-SEARCH * HTTP/1.1 
46	29.133181	192.168.1.3	239.255.255.250	SSDP	206	M-SEARCH * HTTP/1.1 
47	29.133243	172.22.16.1	239.255.255.250	SSDP	206	M-SEARCH * HTTP/1.1 
48	29.133329	172.28.224.1	239.255.255.250	SSDP	206	M-SEARCH * HTTP/1.1 
49	34.537190	127.0.0.1	127.0.0.1	TCP	51	63063 → 8081 [PSH, ACK] Seq=50 Ack=379 Win=10208 Len=7
50	34.537224	127.0.0.1	127.0.0.1	TCP	44	8081 → 63063 [ACK] Seq=379 Ack=57 Win=10230 Len=0
51	34.537278	127.0.0.1	127.0.0.1	TCP	98	8081 → 63063 [PSH, ACK] Seq=379 Ack=57 Win=10230 Len=54
52	34.537302	127.0.0.1	127.0.0.1	TCP	44	63063 → 8081 [ACK] Seq=57 Ack=433 Win=10207 Len=0
53	59.320123	127.0.0.1	127.0.0.1	TCP	51	63063 → 8081 [PSH, ACK] Seq=57 Ack=433 Win=10207 Len=7
54	59.320157	127.0.0.1	127.0.0.1	TCP	44	8081 → 63063 [ACK] Seq=433 Ack=64 Win=10230 Len=0
55	59.320207	127.0.0.1	127.0.0.1	TCP	98	8081 → 63063 [PSH, ACK] Seq=433 Ack=64 Win=10230 Len=54
56	59.320232	127.0.0.1	127.0.0.1	TCP	44	63063 → 8081 [ACK] Seq=64 Ack=487 Win=10207 Len=0
57	60.328185	127.0.0.1	127.0.0.1	TCP	51	63063 → 8081 [PSH, ACK] Seq=64 Ack=487 Win=10207 Len=7
58	60.328211	127.0.0.1	127.0.0.1	TCP	44	8081 → 63063 [ACK] Seq=487 Ack=71 Win=10230 Len=0
59	60.328262	127.0.0.1	127.0.0.1	TCP	98	8081 → 63063 [PSH, ACK] Seq=487 Ack=71 Win=10230 Len=54
60	60.328288	127.0.0.1	127.0.0.1	TCP	44	63063 → 8081 [ACK] Seq=71 Ack=541 Win=10207 Len=0
61	61.152079	127.0.0.1	127.0.0.1	TCP	51	63063 → 8081 [PSH, ACK] Seq=71 Ack=541 Win=10207 Len=7
62	61.152113	127.0.0.1	127.0.0.1	TCP	44	8081 → 63063 [ACK] Seq=541 Ack=78 Win=10230 Len=0
63	61.152159	127.0.0.1	127.0.0.1	TCP	55	8081 → 63063 [PSH, ACK] Seq=541 Ack=78 Win=10230 Len=11
64	61.152185	127.0.0.1	127.0.0.1	TCP	44	63063 → 8081 [ACK] Seq=78 Ack=552 Win=10207 Len=0
65	61.152256	127.0.0.1	127.0.0.1	TCP	44	8081 → 63063 [FIN, ACK] Seq=552 Ack=78 Win=10230 Len=0
66	61.152273	127.0.0.1	127.0.0.1	TCP	44	63063 → 8081 [ACK] Seq=78 Ack=553 Win=10207 Len=0
67	61.153789	127.0.0.1	127.0.0.1	TCP	44	63063 → 8081 [FIN, ACK] Seq=78 Ack=553 Win=10207 Len=0
68	61.153809	127.0.0.1	127.0.0.1	TCP	44	8081 → 63063 [ACK] Seq=553 Ack=79 Win=10230 Len=0
69	65.307849	127.0.0.1	127.0.0.1	TCP	56	58629 → 8081 [SYN] Seq=0 Win=65535 Len=0 MSS=65495 WS=256 SACK_PERM=1
70	65.307913	127.0.0.1	127.0.0.1	TCP	56	8081 → 58629 [SYN, ACK] Seq=0 Ack=1 Win=65535 Len=0 MSS=65495 WS=256 SACK_PERM=1
71	65.307959	127.0.0.1	127.0.0.1	TCP	44	58629 → 8081 [ACK] Seq=1 Ack=1 Win=2619648 Len=0
72	65.308446	127.0.0.1	127.0.0.1	TCP	260	8081 → 58629 [PSH, ACK] Seq=1 Ack=1 Win=2619648 Len=216
73	65.308469	127.0.0.1	127.0.0.1	TCP	44	58629 → 8081 [ACK] Seq=1 Ack=217 Win=2619392 Len=0
74	65.914221	127.0.0.1	127.0.0.1	TCP	191	59981 → 25734 [PSH, ACK] Seq=148 Ack=148 Win=10040 Len=147
75	65.914253	127.0.0.1	127.0.0.1	TCP	44	25734 → 59981 [ACK] Seq=148 Ack=295 Win=10040 Len=0
76	65.914307	127.0.0.1	127.0.0.1	TCP	191	25734 → 59981 [PSH, ACK] Seq=148 Ack=295 Win=10040 Len=147
77	65.914327	127.0.0.1	127.0.0.1	TCP	44	59981 → 25734 [ACK] Seq=295 Ack=295 Win=10039 Len=0
78	68.344140	127.0.0.1	127.0.0.1	TCP	51	58629 → 8081 [PSH, ACK] Seq=1 Ack=217 Win=2619392 Len=7
79	68.344169	127.0.0.1	127.0.0.1	TCP	44	8081 → 58629 [ACK] Seq=217 Ack=8 Win=2619648 Len=0
80	68.344219	127.0.0.1	127.0.0.1	TCP	98	8081 → 58629 [PSH, ACK] Seq=217 Ack=8 Win=2619648 Len=54
81	68.344245	127.0.0.1	127.0.0.1	TCP	44	58629 → 8081 [ACK] Seq=8 Ack=271 Win=2619392 Len=0
82	69.609514	127.0.0.1	127.0.0.1	TCP	51	58629 → 8081 [PSH, ACK] Seq=8 Ack=271 Win=2619392 Len=7
83	69.609549	127.0.0.1	127.0.0.1	TCP	44	8081 → 58629 [ACK] Seq=271 Ack=15 Win=2619648 Len=0
84	69.609597	127.0.0.1	127.0.0.1	TCP	98	8081 → 58629 [PSH, ACK] Seq=271 Ack=15 Win=2619648 Len=54
85	69.609622	127.0.0.1	127.0.0.1	TCP	44	58629 → 8081 [ACK] Seq=15 Ack=325 Win=2619392 Len=0
86	70.765130	127.0.0.1	127.0.0.1	TCP	51	58629 → 8081 [PSH, ACK] Seq=15 Ack=325 Win=2619392 Len=7
87	70.765162	127.0.0.1	127.0.0.1	TCP	44	8081 → 58629 [ACK] Seq=325 Ack=22 Win=2619648 Len=0
88	70.765209	127.0.0.1	127.0.0.1	TCP	98	8081 → 58629 [PSH, ACK] Seq=325 Ack=22 Win=2619648 Len=54
89	70.765234	127.0.0.1	127.0.0.1	TCP	44	58629 → 8081 [ACK] Seq=22 Ack=379 Win=2619392 Len=0
90	71.488000	127.0.0.1	127.0.0.1	TCP	51	58629 → 8081 [PSH, ACK] Seq=22 Ack=379 Win=2619392 Len=7
91	71.488033	127.0.0.1	127.0.0.1	TCP	44	8081 → 58629 [ACK] Seq=379 Ack=29 Win=2619648 Len=0
92	71.488079	127.0.0.1	127.0.0.1	TCP	98	8081 → 58629 [PSH, ACK] Seq=379 Ack=29 Win=2619648 Len=54
93	71.488111	127.0.0.1	127.0.0.1	TCP	44	58629 → 8081 [ACK] Seq=29 Ack=433 Win=2619136 Len=0
94	72.456206	127.0.0.1	127.0.0.1	TCP	51	58629 → 8081 [PSH, ACK] Seq=29 Ack=433 Win=2619136 Len=7
95	72.456245	127.0.0.1	127.0.0.1	TCP	44	8081 → 58629 [ACK] Seq=433 Ack=36 Win=2619648 Len=0
96	72.456286	127.0.0.1	127.0.0.1	TCP	98	8081 → 58629 [PSH, ACK] Seq=433 Ack=36 Win=2619648 Len=54
97	72.456312	127.0.0.1	127.0.0.1	TCP	44	58629 → 8081 [ACK] Seq=36 Ack=487 Win=2619136 Len=0
98	73.207956	127.0.0.1	127.0.0.1	TCP	51	58629 → 8081 [PSH, ACK] Seq=36 Ack=487 Win=2619136 Len=7
99	73.207990	127.0.0.1	127.0.0.1	TCP	44	8081 → 58629 [ACK] Seq=487 Ack=43 Win=2619648 Len=0
100	73.208036	127.0.0.1	127.0.0.1	TCP	98	8081 → 58629 [PSH, ACK] Seq=487 Ack=43 Win=2619648 Len=54
101	73.208062	127.0.0.1	127.0.0.1	TCP	44	58629 → 8081 [ACK] Seq=43 Ack=541 Win=2619136 Len=0
102	74.752106	127.0.0.1	127.0.0.1	TCP	52	58629 → 8081 [PSH, ACK] Seq=43 Ack=541 Win=2619136 Len=8
103	74.752140	127.0.0.1	127.0.0.1	TCP	44	8081 → 58629 [ACK] Seq=541 Ack=51 Win=2619648 Len=0
104	74.752186	127.0.0.1	127.0.0.1	TCP	55	8081 → 58629 [PSH, ACK] Seq=541 Ack=51 Win=2619648 Len=11
105	74.752212	127.0.0.1	127.0.0.1	TCP	44	58629 → 8081 [ACK] Seq=51 Ack=552 Win=2619136 Len=0
106	74.752267	127.0.0.1	127.0.0.1	TCP	44	8081 → 58629 [FIN, ACK] Seq=552 Ack=51 Win=2619648 Len=0
107	74.752283	127.0.0.1	127.0.0.1	TCP	44	58629 → 8081 [ACK] Seq=51 Ack=553 Win=2619136 Len=0
108	74.753593	127.0.0.1	127.0.0.1	TCP	44	58629 → 8081 [FIN, ACK] Seq=51 Ack=553 Win=2619136 Len=0
109	74.753630	127.0.0.1	127.0.0.1	TCP	44	8081 → 58629 [ACK] Seq=553 Ack=52 Win=2619648 Len=0
110	81.010348	192.168.1.3	224.0.0.251	IGMPv2	36	Membership Report group 224.0.0.251
111	84.515259	192.168.1.3	224.0.0.252	IGMPv2	36	Membership Report group 224.0.0.252
112	87.644350	127.0.0.1	127.0.0.1	TCP	56	50564 → 8081 [SYN] Seq=0 Win=65535 Len=0 MSS=65495 WS=256 SACK_PERM=1
113	87.644421	127.0.0.1	127.0.0.1	TCP	56	8081 → 50564 [SYN, ACK] Seq=0 Ack=1 Win=65535 Len=0 MSS=65495 WS=256 SACK_PERM=1
114	87.644446	127.0.0.1	127.0.0.1	TCP	44	50564 → 8081 [ACK] Seq=1 Ack=1 Win=2619648 Len=0
115	87.645283	127.0.0.1	127.0.0.1	TCP	260	8081 → 50564 [PSH, ACK] Seq=1 Ack=1 Win=2619648 Len=216
116	87.645310	127.0.0.1	127.0.0.1	TCP	44	50564 → 8081 [ACK] Seq=1 Ack=217 Win=2619392 Len=0
117	88.512317	192.168.1.3	239.255.255.250	IGMPv2	36	Membership Report group 239.255.255.250
118	94.392479	127.0.0.1	127.0.0.1	TCP	51	50564 → 8081 [PSH, ACK] Seq=1 Ack=217 Win=2619392 Len=7
119	94.392509	127.0.0.1	127.0.0.1	TCP	44	8081 → 50564 [ACK] Seq=217 Ack=8 Win=2619648 Len=0
120	94.392562	127.0.0.1	127.0.0.1	TCP	98	8081 → 50564 [PSH, ACK] Seq=217 Ack=8 Win=2619648 Len=54
121	94.392588	127.0.0.1	127.0.0.1	TCP	44	50564 → 8081 [ACK] Seq=8 Ack=271 Win=2619392 Len=0
122	95.855807	127.0.0.1	127.0.0.1	TCP	51	50564 → 8081 [PSH, ACK] Seq=8 Ack=271 Win=2619392 Len=7
123	95.855835	127.0.0.1	127.0.0.1	TCP	44	8081 → 50564 [ACK] Seq=271 Ack=15 Win=2619648 Len=0
124	95.855875	127.0.0.1	127.0.0.1	TCP	98	8081 → 50564 [PSH, ACK] Seq=271 Ack=15 Win=2619648 Len=54
125	95.855897	127.0.0.1	127.0.0.1	TCP	44	50564 → 8081 [ACK] Seq=15 Ack=325 Win=2619392 Len=0
126	98.601209	127.0.0.1	127.0.0.1	TCP	51	50564 → 8081 [PSH, ACK] Seq=15 Ack=325 Win=2619392 Len=7
127	98.601243	127.0.0.1	127.0.0.1	TCP	44	8081 → 50564 [ACK] Seq=325 Ack=22 Win=2619648 Len=0
128	98.601283	127.0.0.1	127.0.0.1	TCP	55	8081 → 50564 [PSH, ACK] Seq=325 Ack=22 Win=2619648 Len=11
129	98.601298	127.0.0.1	127.0.0.1	TCP	44	50564 → 8081 [ACK] Seq=22 Ack=336 Win=2619392 Len=0
130	98.601349	127.0.0.1	127.0.0.1	TCP	44	8081 → 50564 [FIN, ACK] Seq=336 Ack=22 Win=2619648 Len=0
131	98.601362	127.0.0.1	127.0.0.1	TCP	44	50564 → 8081 [ACK] Seq=22 Ack=337 Win=2619392 Len=0
132	98.602702	127.0.0.1	127.0.0.1	TCP	44	50564 → 8081 [FIN, ACK] Seq=22 Ack=337 Win=2619392 Len=0
133	98.602721	127.0.0.1	127.0.0.1	TCP	44	8081 → 50564 [ACK] Seq=337 Ack=23 Win=2619648 Len=0